Abstract,Keywords,Processed_Abstract
" key clinical messagemedicationrelated osteonecrosis of the jaw ( mronj ) is developed even in the patients who are edentulous and treated with shortterm bisphosphonate therapy and oral administration . 
 it sometimes causes lethal sepsis in patients who have multiple health problems such as diabetes , cirrhosis , steroid use for interstitial pneumonia , sepsis , and spinal disk herniation . ","sepsis, interstitial, lethal, bisphosphonate, shortterm",key clinic messagemedicationrel osteonecrosi jaw mronj develop even patient edentul treat shortterm bisphosphon therapi oral administr sometim caus lethal sepsi patient multipl health problem diabet cirrhosi steroid use interstiti pneumonia sepsi spinal disk herniat
" pik3r1 ( encoding the p85 subunit of phosphatidylinositol 3-kinase ) is the 11th most frequently mutated gene across tumors . 
 we recently reported neomorphic p85 mutants that induce signaling cascades not predicted by the canonical functions of p85 , suggesting the need to functionally annotate specific mutations in cancer genes for effective genome - informed personalized therapy . ","p85, annotate, functionally, cascades, mutants",pik3r1 encod p85 subunit phosphatidylinositol 3kinas 11th frequent mutat gene across tumor recent report neomorph p85 mutant induc signal cascad predict canon function p85 suggest need function annot specif mutat cancer gene effect genom inform person therapi
" objectiveto review the current knowledge about nonpharmacologic approaches in the prevention and early treatment of type 2 diabetes.research design and methodsthis study reviewed the research reports dealing with nonpharmacologic interventions aimed at preventing type 2 diabetes with early lifestyle interventions.resultsthe results from the randomized controlled trials all show that people with impaired glucose tolerance who received enhanced lifestyle advice had significantly lower ( on average 50% reduced ) incidence of type 2 diabetes compared with those allocated to receive  usual care . 
  individuals who were able to correct their lifestyle habits as recommended for usual healthy life patterns were mostly protected against type 2 diabetes . 
 thus , compelling evidence exists that most of the cases of type 2 diabetes can be prevented or at least the onset of the disease can be significantly delayed.conclusionsrandomized controlled trials have unequivocally demonstrated that lifestyle management is highly efficient in the prevention and also in the early management of type 2 diabetes . 
 this evidence of lifestyle modification in diabetes prevention is stronger than for most other multifactorial diseases . ","diabetes, lifestyle, type, prevention, nonpharmacologic",objectiveto review current knowledg nonpharmacolog approach prevent earli treatment type 2 diabetesresearch design methodsthi studi review research report deal nonpharmacolog intervent aim prevent type 2 diabet earli lifestyl interventionsresultsth result random control trial show peopl impair glucos toler receiv enhanc lifestyl advic significantli lower averag 50 reduc incid type 2 diabet compar alloc receiv usual care individu abl correct lifestyl habit recommend usual healthi life pattern mostli protect type 2 diabet thu compel evid exist case type 2 diabet prevent least onset disea significantli delayedconclusionsrandom control trial unequivoc demonstr lifestyl manag highli effici prevent also earli manag type 2 diabet evid lifestyl modif diabet prevent strong multifactori disea
" aim : a study was performed on the articular disk and periarticular tissues of the temporo - mandibular joint ( tmj ) with immunohistochemical techniques to give evidence to the presence of neuroreceptors ( nrec ) in these sites . methods : the study was carried out on tissue samples obtained from 10 subjects without tmj disease and from 7 patients with severe tmj arthritis and arthrosis . 
 we use antibodies directed against following antigens : gliofibrillary acidic protein ( gfap ) , leu-7 , myelin basic protein ( mbp ) , neurofilaments 68 kd ( nf ) , neuron specific enolase ( nse ) , s-100 protein ( s-100 ) and synaptophysin ( syn ) . 
 results : this study revealed that ruffini's - like , pacini's - like and golgi's - like receptors can be demonstrated in tmj periarticular tissues and that free nervous endings are present in the subsynovial tissues but not within the articular disk . 
 we observed elongated cytoplamic processes of chondrocytes that demonstrated strong s-100 immunoreactivity but they were unreactive with all other antibodies . 
 these cytoplamic processes were more abundant and thicker in the samples obtained from patients with disease tmj . 
 conclusion : the results of this study confirm that different nrec are detectable in tmj periarticular tissues but they are absent within the articular disk . in the latter site , only condrocytic processes are evident , especially in diseased tmj , and they might have been confused with nervous endings in previous morphological studies . 
 nevertheless the absence of immunoreactivity for nf , nse and syn proves that they are not of neural origin . ","tmj, tissues, periarticular, disk, articular",aim studi perform articular disk periarticular tissu temporo mandibular joint tmj immunohistochem techniqu give evid presenc neuroreceptor nrec site method studi carri tissu sampl obtain 10 subject without tmj disea 7 patient sever tmj arthriti arthrosi use antibodi direct follow antigen gliofibrillari acid protein gfap leu7 myelin basic protein mbp neurofila 68 kd nf neuron specif enola nse s100 protein s100 synaptophysin syn result studi reveal ruffini like pacini like golgi like receptor demonstr tmj periarticular tissu free nervou end present subsynovi tissu within articular disk observ elong cytoplam process chondrocyt demonstr strong s100 immunoreact unreact antibodi cytoplam process abund thick sampl obtain patient disea tmj conclus result studi confirm differ nrec detect tmj periarticular tissu absent within articular disk latter site condrocyt process evid especi disea tmj might confus nervou end previou morpholog studi nevertheless absenc immunoreact nf nse syn prove neural origin
" background : neurolinguistic programming ( nlp ) refers to the science and art of reaching success and perfection . 
 it is a collection of the skills based on human beings psychological characteristics through which the individuals obtain the ability to use their personal capabilities as much as possible . 
 this study aimed to investigate the efficacy of nlp training on mental health in nursing and midwifery students in islamic azad university tehran medical sciences branch.materials and methods : in this quasi - experimental study , the study population comprised all nursing and midwifery students in islamic azad university , tehran medical branch , of whom 52 were selected and assigned to two groups through random sampling . 
 data collection tool was goldberg general health questionnaire ( 28-item version ) . 
 after primary evaluation , nlp training was given in five 120-min sessions and the groups were re - evaluated . 
 the obtained data were analyzed.results:in the nursing group , paired t - test showed a significant difference in the scores of mental health ( with 39 points decrease ) , physical signs ( with 7.96 scores decrease ) , anxiety ( with 10.75 scores decrease ) , social function ( with 7.05 scores decrease ) and depression ( with 9.38 scores decrease ) . in the midwifery group , it showed a significant difference in mental health ( with 22.63 scores decrease ) , physical signs ( with 6.54 scores decrease ) , anxiety ( with nine scores decrease ) , and depression ( with 8.38 scores decrease).conclusions : this study showed that nlp strategies are effective in the improvement of general health and its various dimensions . 
 therefore , it is essential to conduct structured and executive programs concerning nlp among the students . ","decrease, scores, nlp, midwifery, nursing",background neurolinguist program nlp refer scienc art reach success perfect collect skill base human be psycholog characterist individu obtain abil use person capabl much possibl studi aim investig efficaci nlp train mental health nur midwiferi student islam azad univer tehran medic scienc branchmateri method quasi experiment studi studi popul compris nur midwiferi student islam azad univer tehran medic branch 52 select assign two group random sampl datum collect tool goldberg gener health questionnair 28item version primari evalu nlp train give five 120min session group evalu obtain datum analyzedresultsin nur group pair test show signific differ score mental health 39 point decrea physic sign 796 score decrea anxieti 1075 score decrea social function 705 score decrea depress 938 score decrea midwiferi group show signific differ mental health 2263 score decrea physic sign 654 score decrea anxieti nine score decrea depress 838 score decreaseconclus studi show nlp strategi effect improv gener health variou dimen therefor essenti conduct structur execut program concern nlp among student
" background : polycystic ovary syndrome ( pcos ) is the most common endocrine disorder in reproductive women . 
 nearly 10% of young women in this period involved . 
 although factors such as insulin resistance , hyper insulinemia , obesity and dietary are suggested to be associated with pcos , cause of pcos is not completely understood . 
 dairy products ( a key component of the usual diet ) of participants can also affect the factors of this disease and may have beneficial effects on treatment of pcos . however , 
 research in this area is scarce . the purpose of this study was to evaluate the relationship between dairy products consumption and pcos.methods:this descriptive cross - sectional study of 400 women 
 was conducted in shahid beheshti hospital of isfahan university of medical science , iran . 
 dietary intake was evaluated by validated food frequency questionnaire . 
 other variables such as ovarian disease , inherited predisposition , age at menarche , physical activity and history of other diseases were evaluated using questionnaire . 
 data analysis was performed by a logistic regression test using spss software version 15 predictive analytics software and solutions.results:there were a significant association between pcos and ovarian disease ( p < 0.001 ) , age ( p < 0.001 ) and using medication ( p = 0.001 ) . 
 body mass index ( bmi ) was inversely associated with pcos , but it was not significant ( p = 0.068 ) . 
 there was a significant direct relationship between milk consumption and risk of pcos after adjusting for confounding factors ( p = 0.028).conclusions : the findings of this study indicated that ovarian disease and medication use is directly linked to pcos . 
 dairy consumption was not significantly correlated with pcos . however , after adjustment for confounders , there was an direct relationship between milk consumption and risk of pcos . ","pcos, consumption, dairy, ovarian, relationship",background polycyst ovari syndrom pco common endocrin disord reproduct woman nearli 10 young woman period involv although factor insulin resist hyper insulinemia obe dietari suggest associ pco caus pco complet understand dairi product key compon usual diet particip also affect factor disea may benefici effect treatment pco howev research area scarc purpos studi evalu relationship dairi product consumpt pcosmethodsthi descript cross section studi 400 woman conduct shahid beheshti hospit isfahan univer medic scienc iran dietari intak evalu valid food frequenc questionnair variabl ovarian disea inherit predisposit age menarch physic activ histori disea evalu use questionnair datum analysi perform logist regress test use spss softwar version 15 predict analyt softwar solutionsresultsther signific associ pco ovarian disea p 0001 age p 0001 use medic p 0001 bodi mass index bmi inver associ pco signific p 0068 signific direct relationship milk consumpt risk pco adjust confound factor p 0028conclu find studi indic ovarian disea medic use directli link pco dairi consumpt significantli correl pco howev adjust confound direct relationship milk consumpt risk pco
" background and objectivesmilrinone is often used in children to treat acute heart failure and prevent low cardiac output syndrome after cardiac surgery . due to the lack of studies on the long - term milrinone use in children , the objective of this study was to assess the safety and efficacy of the current patterns of milrinone use for 3 days in infants and children with heart diseases.subjects and methodswe retrospectively reviewed the medical records of patients aged < 13 years who received milrinone for 
 3 days from january 2005 to december 2012 . 
 patients ' characteristics including age , sex , height , weight , and body surface area were recorded . 
 the following parameters were analyzed to identify the clinical application of milrinone : initial infusion rate , maintenance continuous infusion rate , total duration of milrinone therapy , and concomitantly infused inotropes . 
 the safety of milrinone was determined based on the occurrence of adverse events such as hypotension , arrhythmia , chest pain , headache , hypokalemia , and thrombocytopenia.resultswe assessed 730 admissions ( 684 patients ) during this period . 
 ventricular septal defects were the most common diagnosis ( 42.4% ) in these patients . 
 milrinone was primarily used after cardiac surgery in 715 admissions ( 97.9% ) . 
 the duration of milrinone treatment varied from 3 to 64.4 days ( 7 days in 149 admissions ) . ejection fraction and fractional shortening of the left 
 ventricle improved in patients receiving milrinone after cardiac surgery . 
 dose reduction of milrinone due to hypotension occurred in only 4 admissions ( 0.5% ) . 
 although diverse arrhythmias occurred in 75 admissions ( 10.3% ) , modification of milrinone infusion to manage arrhythmia occurred in only 3 admissions ( 0.4% ) . 
 multivariate analysis indicated that the development of arrhythmia was not influenced by the pattern of milrinone use.conclusionmilrinone was generally administered for 3 days in children with heart diseases . 
 the use of milrinone for 3 days was effective in preventing low cardiac output after cardiac surgery when combined with other inotropes , suggesting that milrinone could be safely employed in pediatric patients with heart diseases . ","milrinone, admissions, cardiac, days, heart",background objectivesmilrinon often use child treat acut heart failur prevent low cardiac output syndrom cardiac surgeri due lack studi long term milrinon use child object studi assess safeti efficaci current pattern milrinon use 3 day infant child heart diseasessubject methodsw retrospect review medic record patient age 13 year receiv milrinon 3 day januari 2005 decemb 2012 patient characterist includ age sex height weight bodi surfac area record follow paramet analyz identifi clinic applic milrinon initi infus rate mainten continu infus rate total durat milrinon therapi concomitantli infus inotrop safeti milrinon determin base occurr adver event hypoten arrhythmia chest pain headach hypokalemia thrombocytopeniaresultsw assess 730 admiss 684 patient period ventricular septal defect common diagnosi 424 patient milrinon primarili use cardiac surgeri 715 admiss 979 durat milrinon treatment vari 3 644 day 7 day 149 admiss eject fraction fraction shorten leave ventricl improv patient receiv milrinon cardiac surgeri dose reduct milrinon due hypoten occur 4 admiss 05 although diver arrhythmia occur 75 admiss 103 modif milrinon infus manag arrhythmia occur 3 admiss 04 multivari analysi indic develop arrhythmia influenc pattern milrinon useconclusionmilrinon gener administ 3 day child heart disea use milrinon 3 day effect prevent low cardiac output cardiac surgeri combin inotrop suggest milrinon could safe employ pediatr patient heart disea
" there are few reports in the literature of complete obstruction of the vertebral artery ( va ) due to an electric screw driver bit penetration through the neural foramen into the spinal canal with brown - squard syndrome ( bss ) . 
 a 25-year - old man was admitted to the emergency department with a penetrated neck injury by an electric screw driver bit after a struggle . 
 the patient presented the clinical features of bss . 
 computed tomography scan revealed that the electric screw driver bit penetrated through the right neural foramen at the level of c3 - 4 , and it caused an injury to the right half of the spinal cord . 
 emergent angiography revealed va dissection , which was managed by immediate coil embolization at both proximal and distal ends of the injury site . 
 after occlusion of the va , the electric screw driver bit was extracted under general anesthesia . 
 bleeding was minimal and controlled without difficulties . 
 no postoperative complications , such as wound dehiscence , csf leakage , or infection , were noted . 
 endovascular approaches for occlusion of vertebral artery lesions are safe and effective methods of treatment . ","bit, driver, screw, electric, va",report literatur complet obstruct vertebr arteri va due electr screw driver bit penetr neural foraman spinal canal brown squard syndrom bss 25year old man admit emerg depart penetr neck injuri electr screw driver bit struggl patient present clinic featur bss comput tomographi scan reveal electr screw driver bit penetr right neural foraman level c3 4 caus injuri right half spinal cord emerg angiographi reveal va dissect manag immedi coil embol proxim distal end injuri site occlus va electr screw driver bit extract gener anesthesia bleed minim control without difficulti postop complic wound dehisc csf leakag infect note endovascular approach occlus vertebr arteri lesion safe effect method treatment
" 
 purpose . to characterize the optical coherence tomography ( oct ) findings in late - stage vogt - koyanagi - harada ( vkh ) disease and its correlation with visual function 
 . methods . 
 the records of patients with late - stage vkh disease ( defined as 12 months from disease onset ) were retrospectively reviewed . 
 the analysis focused on the oct findings and microperimetry , in addition to the possible correlation between morphology and functional findings . 
 results . 
 twenty - nine patients ( 58 eyes ) were included . 
 mean age at onset was 34.24  10.67 years . 
 the oct revealed that the outer retina and retinal pigment epithelium ( rpe ) were mainly affected . 
 these effects included rpe thickening and breakage or disappearance of the cone outer segment tip ( cost ) line and/or inner segment / outer segment ( is / os ) junction . 
 the cost line and is / os results were related to macular function and the interval between symptom onset and initiation of high - dose corticosteroid treatment ( all p < 0.01 ) . 
 eyes with intact cost lines demonstrated intact is / os and normal rpe layers as well as better visual function and normal retinal sensitivity . conclusions . 
 the oct findings are strongly correlated with macular function , as well as other clinical findings in late - stage vkh . with respect to the cost line and retinal sensitivity 
 especially , the oct and microperimetry findings may be useful for evaluating later - stage vkh . ","oct, vkh, findings, cost, rpe",purpos character optic coher tomographi oct find late stage vogt koyanagi harada vkh disea correl visual function method record patient late stage vkh disea defin 12 month disea onset retrospect review analysi focus oct find microperimetri addit possibl correl morpholog function find result twenti nine patient 58 eye includ mean age onset 3424 1067 year oct reveal outer retina retin pigment epithelium rpe mainli affect effect includ rpe thicken breakag disappear cone outer segment tip cost line andor inner segment outer segment os junction cost line os result relat macular function interv symptom onset initi high dose corticosteroid treatment p 001 eye intact cost line demonstr intact os normal rpe layer well well visual function normal retin sensit conclus oct find strongli correl macular function well clinic find late stage vkh respect cost line retin sensit especi oct microperimetri find may use evalu later stage vkh
" in - depth , reproducible coverage of complex proteomes is challenging because the complexity of tryptic digests subjected to lc - ms / ms analysis frequently exceeds mass spectrometer analytical capacity , which results in undersampling of data . in this study 
 , we used cancer cell lysates to systematically compare the commonly used gelc - ms / ms ( 1-d protein + 1-d peptide separation ) method using four repetitive injections ( 2-d / repetitive ) with a 3-d method that included solution isoelectric focusing and involved an equal number of lc - ms / ms runs . 
 the 3-d method detected substantially more unique peptides and proteins , including higher numbers of unique peptides from low - abundance proteins , demonstrating that additional fractionation at the protein level is more effective than repetitive analyses at overcoming lc - ms / ms undersampling . 
 importantly , more than 90% of the 2-d / repetitive protein identifications were found in the 3-d method data in a direct protein level comparison , and the reproducibility between data sets increased to greater than 96% when factors such as database redundancy and use of rigid scoring thresholds were considered . 
 hence , high reproducibility of complex proteomes , such as human cancer cell lysates , readily can be achieved when using multidimensional separation methods with good depth of analysis . ","ms, repetitive, lc, method, protein",depth reproduc coverag complex proteom challeng complex tryptic digest subject lc ms ms analysi frequent exce mass spectromet analyt capac result undersampl datum studi use cancer cell lysat systemat compar commonli use gelc ms ms 1d protein 1d peptid separ method use four repetit inject 2d repetit 3d method includ solut isoelectr focus involv equal number lc ms ms run 3d method detect substanti uniqu peptid protein includ high number uniqu peptid low abund protein demonstr addit fraction protein level effect repetit analys overcom lc ms ms undersampl importantli 90 2d repetit protein identif find 3d method datum direct protein level comparison reproduc datum set increa great 96 factor databas redund use rigid score threshold consid henc high reproduc complex proteom human cancer cell lysat readili achiev use multidimension separ method good depth analysi
" the fields of pharmacogenetics and pharmacogenomics have become increasingly promising regarding the clinical application of genetic data to aid in prevention of adverse reactions . 
 specific screening tests can predict which animals express modified proteins or genetic sequences responsible for adverse effects associated with a drug . among the genetic variations that have been investigated in dogs , the multidrug resistance gene ( mdr ) 
 is the best studied . 
 however , other genes such as cyp1a2 and cyp2b11 control the protein syntheses involved in the metabolism of many drugs . in the present study , 
 the mdr-1 , cyp1a2 and cyp2b11 genes were examined to identify snp polymorphisms associated with these genes in the following four canine breeds : uruguayan cimarron , border collie , labrador retriever and german shepherd . 
 the results revealed that several snps of the cyp1a2 and cyp2b11 genes are potential targets for drug sensitivity investigations . ","cyp2b11, cyp1a2, genes, genetic, mdr",field pharmacogenet pharmacogenom becom increasingli promis regard clinic applic genet datum aid prevent adver reaction specif screen test predict anim express modifi protein genet sequenc respon adver effect associ drug among genet variat investig dog multidrug resist gene mdr good studi howev gene cyp1a2 cyp2b11 control protein synthe involv metabol mani drug present studi mdr1 cyp1a2 cyp2b11 gene examin identifi snp polymorph associ gene follow four canin breed uruguayan cimarron border colli labrador retriev german shepherd result reveal sever snp cyp1a2 cyp2b11 gene potenti target drug sensit investig
