Abstract,Keywords,Processed_Abstract
" background : the present study was carried out to assess the effects of community nutrition intervention based on advocacy approach on malnutrition status among school - aged children in shiraz , iran.materials and methods : this case - control nutritional intervention has been done between 2008 and 2009 on 2897 primary and secondary school boys and girls ( 7 - 13 years old ) based on advocacy approach in shiraz , iran . 
 the project provided nutritious snacks in public schools over a 2-year period along with advocacy oriented actions in order to implement and promote nutritional intervention . for evaluation of effectiveness of the intervention growth monitoring indices of pre- and post - intervention were statistically compared.results:the frequency of subjects with body mass index lower than 5% decreased significantly after intervention among girls ( p = 0.02 ) . 
 however , there were no significant changes among boys or total population . 
 the mean of all anthropometric indices changed significantly after intervention both among girls and boys as well as in total population . 
 the pre- and post - test education assessment in both groups showed that the student 's average knowledge score has been significantly increased from 12.5  3.2 to 16.8  4.3 ( p < 0.0001).conclusion : this study demonstrates the potential success and scalability of school feeding programs in iran . 
 community nutrition intervention based on the advocacy process model is effective on reducing the prevalence of underweight specifically among female school aged children . ","intervention, advocacy, school, girls, boys",background present studi carri assess effect commun nutrit intervent base advocaci approach malnutrit statu among school age child shiraz iranmateri method case control nutrit intervent do 2008 2009 2897 primari secondari school boy girl 7 13 year old base advocaci approach shiraz iran project provid nutriti snack public school 2year period along advocaci orient action order implement promot nutrit intervent evalu effect intervent growth monitor indic pre post intervent statist comparedresultsth frequenc subject bodi mass index lower 5 decrea significantli intervent among girl p 002 howev signific chang among boy total popul mean anthropometr indic chang significantli intervent among girl boy well total popul pre post test educ assess group show student averag knowledg score significantli increa 125 32 168 43 p 00001conclus studi demonstr potenti success scalabl school feed program iran commun nutrit intervent base advocaci process model effect reduc preval underweight specif among femal school age child
" backgroundanemia in patients with cancer who are undergoing active therapy is commonly encountered and may worsen quality of life in these patients . the effect of blood transfusion is often temporary and may be associated with serious adverse events . 
 erythropoiesis - stimulating agents are not effective in 30%50% of patients and may have a negative effect on overall survival.aimsto assess the efficacy and feasibility of intravenous iron therapy in patients with cancer who have non - iron - deficiency anemia and who are undergoing treatment with chemotherapy without the use of erythropoiesis - stimulating agents.methodsadult patients with solid cancers and non - iron - deficiency anemia were included . 
 ferric sucrose at a dose of 200 mg was given in short intravenous infusions weekly for a total of 12 weeks . 
 hemoglobin level was measured at baseline , every 3 weeks , and 2 weeks after the last iron infusion ( week 14 ) . 
 adverse events related to intravenous iron were prospectively reported.resultsof 25 patients included , 19 ( 76.0% ) completed at least three iron infusions and 14 ( 56.0% ) finished the planned 12 weeks of therapy . 
 the mean hemoglobin level of the 25 patients at baseline was 9.6 g / dl ( median , 9.9 g / dl ; range , 6.9 g / dl 10.9 g / dl ) . the mean change in hemoglobin level for the 15 patients who completed at least 9 treatments was 1.7 g / dl ( median , 1.1 g / dl ; range , 1.9 g / dl to 3.2 g / dl ) ; it reached 2.1 g / dl ( median , 1.3 g / dl ; range , 0.2 g / dl to 4.6 g / dl ; p = 0.0007 ) for the 14 patients who completed all 12 weekly treatments . 
 five ( 20.0% ) patients were transfused and considered as treatment failures . 
 no treatment - related adverse events were reported.conclusionintravenous iron treatment alone is safe and may reduce blood transfusion requirements and improve hemoglobin level in patients with cancer who are undergoing anticancer therapy . 
 further randomized studies are needed to confirm these findings . ","dl, iron, patients, hemoglobin, weeks",backgroundanemia patient cancer undergo activ therapi commonli encount may worsen qualiti life patient effect blood transfu often temporari may associ seriou adver event erythropoiesi stimul agent effect 3050 patient may neg effect overal survivalaimsto assess efficaci feasibl intraven iron therapi patient cancer non iron defici anemia undergo treatment chemotherapi without use erythropoiesi stimul agentsmethodsadult patient solid cancer non iron defici anemia includ ferric sucro dose 200 mg give short intraven infus weekli total 12 week hemoglobin level measur baselin everi 3 week 2 week last iron infus week 14 adver event relat intraven iron prospect reportedresultsof 25 patient includ 19 760 complet least three iron infus 14 560 finish plan 12 week therapi mean hemoglobin level 25 patient baselin 96 g dl median 99 g dl rang 69 g dl 109 g dl mean chang hemoglobin level 15 patient complet least 9 treatment 17 g dl median 11 g dl rang 19 g dl 32 g dl reach 21 g dl median 13 g dl rang 02 g dl 46 g dl p 00007 14 patient complet 12 weekli treatment five 200 patient transfu consid treatment failur treatment relat adver event reportedconclusionintraven iron treatment alon safe may reduc blood transfu requir improv hemoglobin level patient cancer undergo anticanc therapi random studi need confirm find
" tardive dystonia ( td ) is a serious side effect of antipsychotic medications , more with typical antipsychotics , that is potentially irreversible in affected patients . 
 studies show that newer atypical antipsychotics have a lower risk of td . as a result , many clinicians may have developed a false sense of security when prescribing these medications . 
 we report a case of 20-year - old male with hyperthymic temperament and borderline intellectual functioning , who developed severe td after low dose short duration exposure to atypical antipsychotic risperidone and then olanzapine . 
 the goal of this paper is to alert the reader to be judicious and cautious before using casual low dose second generation antipsychotics in patient with no core psychotic features , hyperthymic temperament , or borderline intellectual functioning suggestive of organic brain damage , who are more prone to develop adverse effects such as td and monitor the onset of td in patients taking atypical antipsychotics . ","td, antipsychotics, atypical, temperament, hyperthymic",tardiv dystonia td seriou side effect antipsychot medic typic antipsychot potenti irrever affect patient studi show new atyp antipsychot lower risk td result mani clinician may develop fal sen secur prescrib medic report case 20year old male hyperthym tempera borderlin intellectu function develop sever td low dose short durat exposur atyp antipsychot risperidon olanzapin goal paper alert reader judici cautiou use casual low dose second gener antipsychot patient core psychot featur hyperthym tempera borderlin intellectu function suggest organ brain damag prone develop adver effect td monitor onset td patient take atyp antipsychot
" many lepidopteran insects are agricultural pests that affect stored grains , food and fiber crops . 
 these insects have negative ecological and economic impacts since they lower crop yield , and pesticides are expensive and can have off - target effects on beneficial arthropods 
 . a better understanding of lepidopteran immunity will aid in identifying new targets for the development of specific insect pest management compounds . 
 a fundamental aspect of immunity , and therefore a logical target for control , is the induction of antimicrobial peptide ( amp ) expression . 
 these peptides insert into and disrupt microbial membranes , thereby promoting pathogen clearance and insect survival . 
 pathways leading to amp expression have been extensively studied in the dipteran drosophila melanogaster . however , diptera are an important group of pollinators and pest management strategies that target their immune systems is not recommended . 
 recent advances have facilitated investigation of lepidopteran immunity , revealing both conserved and derived characteristics . 
 although the general pathways leading to amp expression are conserved , specific components of these pathways , such as recognition proteins have diverged . in this review 
 we highlight how such comparative immunology could aid in developing pest management strategies that are specific to agricultural insect pests . ","amp, pest, insect, lepidopteran, immunity",mani lepidopteran insect agricultur pest affect store grain food fiber crop insect neg ecolog econom impact sinc lower crop yield pesticid expen target effect benefici arthropod well understand lepidopteran immun aid identifi new target develop specif insect pest manag compound fundament aspect immun therefor logic target control induct antimicrobi peptid amp express peptid insert disrupt microbi membran therebi promot pathogen clearanc insect surviv pathway lead amp express extens studi dipteran drosophila melanogast howev diptera import group pollin pest manag strategi target immun system recommend recent advanc facilit investig lepidopteran immun reveal conserv deriv characterist although gener pathway lead amp express conserv specif compon pathway recognit protein diverg review highlight compar immunolog could aid develop pest manag strategi specif agricultur insect pest
" we present an unusual case of recurrent cough syncope in a 43-year - old woman , which was initially thought to be seizures . 
 syncopal episodes were triggered by paroxysms of cough and were characterized by unresponsiveness and myoclonic jerks in her extremities . 
 she had a left - sided glomus jugulare tumor that extended into the posterior cranial fossa with evidence of worsening communicating hydrocephalus on brain imaging . 
 we postulate that bouts of cough produced increased intracranial pressure both by raising intrathoracic and intraabdominal pressures as well as by transient obstruction to cerebrospinal fluid flow secondary to intermittent tonsillar herniation during cough . 
 this resulted in diffuse decrease in cerebral blood flow causing syncope . 
 the patient 's syncopal episodes decreased in frequency once an external ventricular drain was placed followed by a ventriculoperitoneal shunt . 
 search for factors that can increase intracranial pressure seems warranted in patients with recurrent cough syncope . ","cough, syncope, syncopal, intracranial, flow",present unusu case recurr cough syncop 43year old woman initi think seizur syncop episod trigger paroxysm cough character unrespon myoclon jerk extrem leave side glomu jugular tumor extend posterior cranial fossa evid worsen commun hydrocephalu brain imag postul bout cough produc increa intracrani pressur rais intrathorac intraabdomin pressur well transient obstruct cerebrospin fluid flow secondari intermitt tonsillar herniat cough result diffus decrea cerebr blood flow caus syncop patient syncop episod decrea frequenc extern ventricular drain place follow ventriculoperiton shunt search factor increa intracrani pressur seem warrant patient recurr cough syncop
" backgroundmicrornas ( mirnas ) play pivotal roles in spermatogenesis . 
 microrna-210 ( mir-210 ) expression was up - regulated in the testes of sterile men with non - obstructive azoospermia ( noa ) . 
 however , the underlying mechanisms of mir-210 involved in the spermatogenesis in patients with noa are unknown.material/methodsexpression of mir-210 and insulin - like growth factor ii ( igf2 ) in the testes of noa cases ( only including maturation arrest and hypospermatogenesis ) were detected in this study . 
 we carried out in vitro experiments to determine if igf2 was directly targeted by mir-210 in nt2 cells.resultscompared with obstructive azoospermia ( oa ) as normal control , our results suggest that mir-210 was significantly up - regulated in testis of patients with noa ( p<0.05 ) , and igf2 was down - regulated , but without a significant difference . 
 the results also indicated that igf2 was directly targeted by mir-210 in nt2 cells.conclusionsthe results showed that mir-210 was involved in spermatogenesis by targeting igf2 in male infertility . ","210, mir, igf2, noa, spermatogenesis",backgroundmicrorna mirna play pivot role spermatogenesi microrna210 mir210 express regul test steril man non obstruct azoospermia noa howev underli mechan mir210 involv spermatogenesi patient noa unknownmaterialmethodsexpress mir210 insulin like growth factor ii igf2 test noa case includ matur arrest hypospermatogenesi detect studi carri vitro experi determin igf2 directli target mir210 nt2 cellsresultscompar obstruct azoospermia oa normal control result suggest mir210 significantli regul testi patient noa p005 igf2 regul without signific differ result also indic igf2 directli target mir210 nt2 cellsconclusionsth result show mir210 involv spermatogenesi target igf2 male infertil
" 
 objective . 
 the objective of this study was to describe the recent clinical characteristics of labor using 3 systems of japanese midwife - led primary delivery care , as follows : ( 1 ) those intending to give birth at home managed by midwives who do not belong to our hospital , ( 2 ) those planning to give birth in our hospital managed by the same midwives , and ( 3 ) those planning to give birth managed by midwives who belong to our hospital . 
 methods . a retrospective cohort study was performed . 
 results . 
 there were no significant differences in the obstetric or neonatal outcomes among the 3 groups . 
 the rate of transfers during labor with the system involving midwives belonging to our hospital was higher than those with the other 2 systems . 
 in addition , the timing of transfers in the system with the midwives belonging to our hospital was earlier than with the other 2 systems . among the 3 groups , 
 there were no significant differences in the rate of the main 2 indications for transfers : fetal heart rate abnormality and failure to progress . conclusion . 
 there were no significant differences in perinatal outcomes among the 3 systems ; however , there were some differences in the status of transfers to obstetric shared care . ","midwives, transfers, hospital, birth, differences",object object studi describ recent clinic characterist labor use 3 system japane midwif lead primari deliveri care follow 1 intend give birth home manag midwiv belong hospit 2 plan give birth hospit manag midwiv 3 plan give birth manag midwiv belong hospit method retrospect cohort studi perform result signific differ obstetr neonat outcom among 3 group rate transfer labor system involv midwiv belong hospit high 2 system addit time transfer system midwiv belong hospit early 2 system among 3 group signific differ rate main 2 indic transfer fetal heart rate abnorm failur progress conclus signific differ perinat outcom among 3 system howev differ statu transfer obstetr share care
" type 2 diabetes is characterized by insulin resistance , and enpp1 plays an important role in insulin resistance . 
 we investigated the association of the enpp1 k121q polymorphism with both diabetes and obesity ( body mass index [ bmi ] ) in korean male workers . 
 the study design was case - control . 
 subjects were 1,945 male workers ( type 2 diabetes , 195 ; non - diabetes , 1,750 ) of nuclear power plants who received examinations from march to october in 2004 . 
 we collected venous blood samples under fasting ( 8 hr ) conditions , calculated bmi by height and weight , and assessed relevant biochemical factors . 
 the results of this study demonstrated that the enpp1 121q genotype ( kq+qq types ) was not associated with type 2 diabetes ( odds ratios [ or ] , 0.854 ; 95% confidence interval [ ci ] , 0.571 - 1.278 ) or obesity ( or , 0.933 ; 95% ci , 0.731 - 1.190 ) . 
 in addition , the frequency of the q allele was not related to type 2 diabetes ( or , 0.911 ; 95% ci , 0.630 - 1.319 ) or obesity ( or , 0.962 ; 95% ci , 0.767 - 1.205 ) . 
 we concluded that the enpp1 121q allele is not a critical determinant for either diabetes or obesity in korean males . 
 the discordance between the results of this study and those derived from studies of dominican , south asian , caucasian , finnish , and french populations might be due to differences in genetic backgrounds between these populations . ","diabetes, enpp1, obesity, ci, 95",type 2 diabet character insulin resist enpp1 play import role insulin resist investig associ enpp1 k121q polymorph diabet obe bodi mass index bmi korean male worker studi design case control subject 1945 male worker type 2 diabet 195 non diabet 1750 nuclear power plant receiv examin march octob 2004 collect venou blood sampl fast 8 hr condit calcul bmi height weight assess relev biochem factor result studi demonstr enpp1 121q genotyp kqqq type associ type 2 diabet odd ratio 0854 95 confid interv ci 0571 1278 obe 0933 95 ci 0731 1190 addit frequenc q allel relat type 2 diabet 0911 95 ci 0630 1319 obe 0962 95 ci 0767 1205 conclud enpp1 121q allel critic determin either diabet obe korean male discord result studi deriv studi dominican south asian caucasian finnish french popul might due differ genet background popul
" lipid apheresis is used to treat patients with severe hyperlipidemia by reducing low - density lipoprotein cholesterol ( ldl - c ) . 
 this study examines the effect of apheresis on the lipid panel and cardiac event rates before and after apheresis . 
 an electronic health record screen of ambulatory patients identified 11 active patients undergoing lipid apheresis with 10/11 carrying a diagnosis of fh . 
 baseline demographics , pre- and postapheresis lipid levels , highest recorded ldl - c , cardiac events , current medications , and first apheresis treatment were recorded . 
 patients completed a questionnaire and self - reported risk factors and interest in alternative treatment . 
 there were significant reductions in mean total cholesterol ( 58.4% ) , ldl - c ( 71.9% ) , triglycerides ( 51% ) , high - density lipoprotein ( hdl ) cholesterol ( 9.3% ) , and non - hdl ( 68.2% ) values . 
 thirty - four cardiac events were documented in 8 patients before apheresis , compared with 9 events in 5 patients after apheresis . 
 our survey showed a high prevalence of statin intolerance ( 64% ) , with the majority ( 90% ) of participants indicating an interest in alternative treatment options . 
 our results have shown that lipid apheresis primary effect is a marked reduction in ldl - c cholesterol levels and may reduce the recurrence of cardiac events . 
 apheresis should be compared to the newer alternative treatment modalities in a randomized fashion due to patient interest in alternative options . ","apheresis, ldl, lipid, cholesterol, alternative",lipid apheresi use treat patient sever hyperlipidemia reduc low densiti lipoprotein cholesterol ldl c studi examin effect apheresi lipid panel cardiac event rate apheresi electron health record screen ambulatori patient identifi 11 activ patient undergo lipid apheresi 1011 carri diagnosi fh baselin demograph pre postapheresi lipid level high record ldl c cardiac event current medic first apheresi treatment record patient complet questionnair self report risk factor interest altern treatment signific reduct mean total cholesterol 584 ldl c 719 triglycerid 51 high densiti lipoprotein hdl cholesterol 93 non hdl 682 valu thirti four cardiac event document 8 patient apheresi compar 9 event 5 patient apheresi survey show high preval statin intoler 64 major 90 particip indic interest altern treatment option result show lipid apheresi primari effect mark reduct ldl c cholesterol level may reduc recurr cardiac event apheresi compar new altern treatment modal random fashion due patient interest altern option
" background : agenesis of the inferior vena cava ( ivc ) as a cause of recurrent deep vein thrombosis ( dvt ) is uncommon.case:a 33-year - old male with no family history of thrombophilia , who had experienced multiple recurrent episodes of dvt over a 15-year period of unknown cause , was admitted into our hospital because of cellulitis in the right leg . 
 computer tomography with contrast of the abdomen showed an absence of ivc.conclusion:congenital absence of the ivc could be a rare risk factor for idiopathic dvt , especially in young individuals . ","ivc, dvt, recurrent, absence, cause",background agenesi inferior vena cava ivc caus recurr deep vein thrombosi dvt uncommoncasea 33year old male famili histori thrombophilia experienc multipl recurr episod dvt 15year period unknown caus admit hospit cellul right leg comput tomographi contrast abdomen show absenc ivcconclusioncongenit absenc ivc could rare risk factor idiopath dvt especi young individu
" we examined the usefulness of brief neuropsychological tests and serum a as a predictive test for detecting mci / ad in older adults . 
 serum a levels were measured from 208 subjects who were cognitively normal at enrollment and blood draw . 
 twenty - eight of the subjects subsequently developed mci ( n = 18 ) or ad ( n = 10 ) over the follow - up period . 
 baseline measures of global cognition , memory , language fluency , and serum a142 and the ratio of serum a142/a140 were significant predictors for future mci / ad using cox regression with demographic variables , apoe 4 , vascular risk factors , and specific medication as covariates . an optimal sensitivity of 85.2% and specificity of 86.5% for predicting mci / ad was achieved using roc analyses . 
 brief neuropsychological tests and measurements of a142 obtained via blood warrants further study as a practical and cost effective method for wide - scale screening for identifying older adults who may be at - risk for pathological cognitive decline . ","mci, ad, a142, serum, neuropsychological",examin use brief neuropsycholog test serum predict test detect mci ad old adult serum level measur 208 subject cognit normal enrol blood draw twenti eight subject subsequ develop mci n 18 ad n 10 follow period baselin measur global cognit memori languag fluenci serum a142 ratio serum a142a140 signific predictor futur mci ad use cox regress demograph variabl apo 4 vascular risk factor specif medic covari optim sensit 852 specif 865 predict mci ad achiev use roc analys brief neuropsycholog test measur a142 obtain via blood warrant studi practic cost effect method wide scale screen identifi old adult may risk patholog cognit declin
