Abstract,Keywords,Processed_Abstract
" objectiveexogenous administration of glucagon - like peptide-1 ( glp-1 ) or glp-1 receptor agonists such as an exendin-4 has direct beneficial effects on the cardiovascular system . 
 however , their effects on atherosclerogenesis have not been elucidated . 
 the aim of this study was to investigate the effects of glp-1 on accumulation of monocytes / macrophages on the vascular wall , one of the earliest steps in atherosclerogenesis.research design and methodsafter continuous infusion of low ( 300 pmol  
 kg1  
 day1 ) or high ( 24 nmol  kg1  
 day1 ) dose of exendin-4 in c57bl/6 or apolipoprotein e 
  deficient mice ( apoe/ ) , we evaluated monocyte adhesion to the endothelia of thoracic aorta and arteriosclerotic lesions around the aortic valve . 
 the effects of exendin-4 were investigated in mouse macrophages and human monocytes.resultstreatment with exendin-4 significantly inhibited monocytic adhesion in the aortas of c57bl/6 mice without affecting metabolic parameters . in apoe/ mice , the same treatment reduced monocyte adhesion to the endothelium and suppressed atherosclerogenesis . in vitro treatment of mouse macrophages with 
 exendin-4 suppressed lipopolysaccharide - induced mrna expression of tumor necrosis factor- and monocyte chemoattractant protein-1 , and suppressed nuclear translocation of p65 , a component of nuclear factor-b . 
 this effect was reversed by either mdl-12330a , a camp inhibitor or pki14 - 22 , a protein kinase a  specific inhibitor . in human monocytes , exendin-4 reduced the expression of cd11b.conclusionsour data suggested that glp-1 receptor agonists reduced monocyte / macrophage accumulation in the arterial wall by inhibiting the inflammatory response in macrophages , and that this effect may contribute to the attenuation of atherosclerotic lesion by exendin-4 . ","exendin, monocyte, glp, macrophages, atherosclerogenesis",objectiveexogen administr glucagon like peptide1 glp1 glp1 receptor agonist exendin4 direct benefici effect cardiovascular system howev effect atherosclerogenesi elucid aim studi investig effect glp1 accumul monocyt macrophag vascular wall one early step atherosclerogenesisresearch design methodsaft continu infus low 300 pmol kg1 day1 high 24 nmol kg1 day1 dose exendin4 c57bl6 apolipoprotein e defici mouse apo evalu monocyt adhe endothelia thorac aorta arteriosclerot lesion around aortic valv effect exendin4 investig mous macrophag human monocytesresultstreat exendin4 significantli inhibit monocyt adhe aorta c57bl6 mouse without affect metabol paramet apo mouse treatment reduc monocyt adhe endothelium suppress atherosclerogenesi vitro treatment mous macrophag exendin4 suppress lipopolysaccharid induc mrna express tumor necrosi factor monocyt chemoattract protein1 suppress nuclear transloc p65 compon nuclear factorb effect rever either mdl12330a camp inhibitor pki14 22 protein kina specif inhibitor human monocyt exendin4 reduc express cd11bconclusionsour datum suggest glp1 receptor agonist reduc monocyt macrophag accumul arteri wall inhibit inflammatori respon macrophag effect may contribut attenu atherosclerot lesion exendin4
" 
 objective . we aimed to examine the independent contributions of physical health and cognitive function to disability among chinese older adults living in two asian metropolises and 
 explore the potential influences of environment . 
 
 design and participants . 
 cross - sectional analysis based on data from two population - based studies : the shanghai survey of alzheimer 's disease and dementia ( n = 4639 ) and the singapore longitudinal ageing study ( n = 2397 ) . 
 disability was defined as needing help in at least one activity of daily living . 
 
 results . 
 the prevalence of functional disability was higher in shanghai sample ( 5% ) than that in singapore sample ( 1.8% ) . 
 number of chronic diseases , self - rated health status , cognitive function ( measured by the mini - mental state examination ) , and environment ( singapore versus shanghai ) significantly contributed to functional disability independent of each other . 
 the adjusted odds ratio was 1.35 ( 95%ci   1.221.50 ) , 2.85 ( 95% ci 2.363.43 ) , 0.89 ( 95% ci 0.850.94 ) , and 0.68 ( 95% ci 0.480.96 ) , respectively . 
 the strength of associations between health variables and disability appeared to be influenced by environment . 
 
 conclusion . 
 physical health and cognitive function independently contributed to functional disability . 
 the associations are modulated by environmental factors . ","disability, shanghai, singapore, ci, 95",object aim examin independ contribut physic health cognit function disabl among chine old adult live two asian metropolis explor potenti influenc environ design particip cross section analysi base datum two popul base studi shanghai survey alzheim disea dementia n 4639 singapor longitudin age studi n 2397 disabl defin need help least one activ daili live result preval function disabl high shanghai sampl 5 singapor sampl 18 number chronic disea self rate health statu cognit function measur mini mental state examin environ singapor versu shanghai significantli contribut function disabl independ adjust odd ratio 135 95ci 122150 285 95 ci 236343 089 95 ci 085094 068 95 ci 048096 respect strength associ health variabl disabl appear influenc environ conclus physic health cognit function independ contribut function disabl associ modul environment factor
" as the delivery of selectively targeted 
 cytotoxic agents via antibodies 
 or small molecule ligands to malignancies has begun to show promise 
 in the clinic , the need to identify and validate additional cellular 
 targets for specific therapeutic delivery is critical . 
 although a 
 multitude of cancers have been targeted using the folate receptor , 
 psma , bombesin receptor , somatostatin receptor , lhrh , and v3 , there is a notable lack of specific small 
 molecule ligand / receptor pairs to cellular targets found within cancers 
 of the gi tract . 
 because of the selective gi tract expression of the 
 cholecystokinin 2 receptor ( cck2r ) , we undertook the creation of conjugates 
 that would deliver microtubule - disrupting drugs to malignancies through 
 the specific targeting of cck2r via a high affinity small molecule 
 ligand . 
 the cytotoxic activity of these conjugates were shown to be 
 receptor mediated in vitro and in vivo with xenograft mouse models 
 exhibiting delayed growth or regression of tumors that expressed cck2r . 
 
 overall , this work demonstrates that ligands to cck2r can be used 
 to create selectively targeted therapeutic conjugates . ","receptor, cck2r, conjugates, molecule, targeted",deliveri select target cytotox agent via antibodi small molecul ligand malign begin show promis clinic need identifi valid addit cellular target specif therapeut deliveri critic although multitud cancer target use folat receptor psma bombesin receptor somatostatin receptor lhrh v3 notabl lack specif small molecul ligand receptor pair cellular target find within cancer gi tract select gi tract express cholecystokinin 2 receptor cck2r undertake creation conjug would deliv microtubul disrupt drug malign specif target cck2r via high affin small molecul ligand cytotox activ conjug show receptor mediat vitro vivo xenograft mous model exhibit delay growth regress tumor express cck2r overal work demonstr ligand cck2r use creat select target therapeut conjug
" nowadays , data acquisition software and sensors are being widely used in introductory physics laboratories . 
 this allows the student to spend more time exploring the data that is collected by the computer hence focusing more on the physical concept . 
 very often , a faculty is faced with the challenge of updating or introducing a microcomputer - based laboratory ( mbl ) at his or her institution . 
 this article will provide a list of experiments and equipment needed to convert about half of the traditional labs on a 1-year introductory physics lab into mbls . ","physics, introductory, mbls, labs, convert",nowaday datum acquisit softwar sensor wide use introductori physic laboratori allow student spend time explor datum collect comput henc focus physic concept often faculti face challeng updat introduc microcomput base laboratori mbl institut articl provid list experi equip need convert half tradit lab 1year introductori physic lab mbl
" octane - enhancing constituents of gasoline pose a number of health hazards . 
 this paper considers the relative risks of metallic ( lead , manganese ) , aromatic ( e.g. , benzene ) , and oxygenated additives in both industrialized and developing countries . technological advances , particularly in industrialized countries , have allowed the progressive removal of lead from gasoline and the increased control of exhaust emissions . 
 the developing world , by contrast , has relatively lax environmental standards and faces serious public health problems from vehicle exhaust and the rapid increase in automobile use . 
 financial obstacles to the modernization of refineries and vehicle fleets compound this problem and the developing world continues to import large quantities of lead additives and other hazardous materials . 
 progress in decreasing environmental health problems depends both on the adoption of international public health standards as well as efforts to decrease dependence on the private automobile for urban transport.imagesfigure 1.figure 2 . ","developing, health, standards, exhaust, industrialized",octan enhanc constitu gasolin pose number health hazard paper consid rel risk metal lead mangane aromat eg benzen oxygen addit industri develop countri technolog advanc particularli industri countri allow progress remov lead gasolin increa control exhaust emiss develop world contrast rel lax environment standard face seriou public health problem vehicl exhaust rapid increa automobil use financi obstacl modern refineri vehicl fleet compound problem develop world continu import larg quantiti lead addit hazard materi progress decrea environment health problem depend adopt intern public health standard well effort decrea depend privat automobil urban transportimagesfigur 1figur 2
" there is a recognized need for new treatment options for type 2 diabetes mellitus ( t2 dm ) . 
 recovery of glucose from the glomerular filtrate represents an important mechanism in maintaining glucose homeostasis and represents a novel target for the management of t2 dm . 
 recovery of glucose from the glomerular filtrate is executed principally by the type 2 sodium - glucose cotransporter ( sglt2 ) . 
 inhibition of sglt2 promotes glucose excretion and normalizes glycemia in animal models . 
 first reports of specifically designed sglt2 inhibitors began to appear in the second half of the 1990s . 
 several candidate sglt2 inhibitors are currently under development , with four in the later stages of clinical testing . the safety profile of sglt2 inhibitors 
 is expected to be good , as their target is a highly specific membrane transporter expressed almost exclusively within the renal tubules . 
 one safety concern is that of glycosuria , which could predispose patients to increased urinary tract infections . 
 so far the reported safety profile of sglt2 inhibitors in clinical studies appears to confirm that the class is well tolerated . where sglt2 inhibitors will fit in the current cascade of treatments for t2 dm has yet to be established . 
 the expected favorable safety profile and insulin - independent mechanism of action appear to support their use in combination with other antidiabetic drugs . 
 promotion of glucose excretion introduces the opportunity to clear calories ( 8090 g [ 300400 calories ] of glucose per day ) in patients that are generally overweight , and is expected to work synergistically with weight reduction programs . 
 experience will most likely lead to better understanding of which patients are likely to respond best to sglt2 inhibitors , and under what circumstances . ","sglt2, inhibitors, glucose, safety, t2",recogn need new treatment option type 2 diabet mellitu t2 dm recoveri glucos glomerular filtrat repre import mechan maintain glucos homeostasi repre novel target manag t2 dm recoveri glucos glomerular filtrat execut princip type 2 sodium glucos cotransport sglt2 inhibit sglt2 promot glucos excret normal glycemia anim model first report specif design sglt2 inhibitor begin appear second half 1990 sever candid sglt2 inhibitor current develop four later stage clinic test safeti profil sglt2 inhibitor expect good target highli specif membran transport express almost exclus within renal tubul one safeti concern glycosuria could predispo patient increa urinari tract infect far report safeti profil sglt2 inhibitor clinic studi appear confirm class well toler sglt2 inhibitor fit current cascad treatment t2 dm yet establish expect favor safeti profil insulin independ mechan action appear support use combin antidiabet drug promot glucos excret introduc opportun clear calori 8090 g 300400 calori glucos per day patient gener overweight expect work synergist weight reduct program experi like lead well understand patient like respond good sglt2 inhibitor circumst
" aimsthis trial was designed to test the hypothesis that shock efficacy during follow - up is not impaired in patients implanted without defibrillation ( df ) testing during first implantable cardioverter - defibrillator ( icd ) implantation.methods and resultsbetween february 2011 and july 2013 , 1077 patients were randomly assigned ( 1 : 1 ) to first time icd implantation with ( n = 540 ) or without ( n = 537 ) df testing . 
 the intra - operative df testing was standardized across all participating centres , and all icd shocks were programmed to 40 j irrespective of df test results . 
 the primary end point was the average first shock efficacy ( fse ) for all true ventricular tachycardia and fibrillation ( vt / vf ) episodes during follow - up . 
 the secondary end points included procedural data , serious adverse events , and mortality . during a median follow - up of 22.8 months 
 , the model - based fse was found to be non - inferior in patients with an icd implanted without a df test , with a difference in fse of 3.0% in favour of the no df test [ confidence interval ( ci ) 3.0 to 9.0% , pnon - inferiority < 0.001 for the pre - defined non - inferiority margin of 10% ) . a total of 112 procedure - related serious adverse events occurred within 30 days in 94 patients ( 17.6% ) tested compared with 89 events in 74 patients ( 13.9% ) not tested ( p = 0.095).conclusiondefibrillation efficacy during follow - up is not inferior in patients with a 40 j icd implanted without df testing . 
 defibrillation testing during first time icd implantation should no longer be recommended for routine left - sided icd implantation . ","df, icd, testing, implantation, fse",aimsthi trial design test hypothesi shock efficaci follow impair patient implant without defibril df test first implant cardiovert defibril icd implantationmethod resultsbetween februari 2011 juli 2013 1077 patient randomli assign 1 1 first time icd implant n 540 without n 537 df test intra oper df test standard across particip centr icd shock program 40 j irrespect df test result primari end point averag first shock efficaci fse true ventricular tachycardia fibril vt vf episod follow secondari end point includ procedur datum seriou adver event mortal median follow 228 month model base fse find non inferior patient icd implant without df test differ fse 30 favour df test confid interv ci 30 90 pnon inferior 0001 pre defin non inferior margin 10 total 112 procedur relat seriou adver event occur within 30 day 94 patient 176 test compar 89 event 74 patient 139 test p 0095conclusiondefibril efficaci follow inferior patient 40 j icd implant without df test defibril test first time icd implant long recommend routin leave side icd implant
" introductionincontinent urinary diversion using an ileal conduit is the most popular method used by urologists after bladder cystectomy resulting from muscle invasive bladder cancer . 
 the use of gastrointestinal tissue is related to a series of complications with the necessity of surgical procedure extension which increases the time of surgery . 
 regenerative medicine together with tissue engineering techniques gives hope for artificial urinary conduit construction de novo without affecting the ileum.material and methodsin this review we analyzed history of urinary diversion together with current attempts in urinary conduit construction using tissue engineering methods . 
 based on literature and our own experience we presented future perspectives related to the artificial urinary conduit construction.resultsa small number of papers in the field of tissue engineered urinary conduit construction indicates that this topic requires more attention . 
 three main factors can be distinguished to resolve this topic : proper scaffold construction along with proper regeneration of both the urothelium and smooth muscle layers.conclusionsartificial urinary conduit has a great chance to become the first commercially available product in urology constructed by regenerative medicine methods . ","conduit, urinary, construction, tissue, artificial",introductionincontin urinari diver use ileal conduit popular method use urologist bladder cystectomi result muscl invas bladder cancer use gastrointestin tissu relat seri complic necess surgic procedur extens increa time surgeri regen medicin togeth tissu engin techniqu give hope artifici urinari conduit construct de novo without affect ileummateri methodsin review analyz histori urinari diver togeth current attempt urinari conduit construct use tissu engin method base literatur experi present futur perspect relat artifici urinari conduit constructionresultsa small number paper field tissu engin urinari conduit construct indic topic requir attent three main factor distinguish resolv topic proper scaffold construct along proper regener urothelium smooth muscl layersconclusionsartifici urinari conduit great chanc becom first commerci avail product urolog construct regen medicin method
" backgroundclinical studies suggest that hemodiafiltration ( hdf ) may lead to better clinical outcomes than high - flux hemodialysis ( hf - hd ) , but concerns have been raised about the cost - effectiveness of hdf versus hf - hd . 
 aim of this study was to investigate whether clinical benefits , in terms of longer survival and better health - related quality of life , are worth the possibly higher costs of hdf compared to hf-hd.methodsthe analysis comprised a simulation based on the combined results of previous published studies , with the following steps : 1 ) estimation of the survival function of hf - hd patients from a clinical trial and of hdf patients using the risk reduction estimated in a meta - analysis ; 2 ) simulation of the survival of the same sample of patients as if allocated to hf - hd or hdf using three - state markov models ; and 3 ) application of state - specific health - related quality of life coefficients and differential costs derived from the literature . 
 several monte carlo simulations were performed , including simulations for patients with different risk profiles , for example , by age ( patients aged 40 , 50 , and 60 years ) , sex , and diabetic status . 
 scatter plots of simulations in the cost - effectiveness plane were produced , incremental cost - effectiveness ratios were estimated , and cost - effectiveness acceptability curves were computed.resultsan incremental cost - effectiveness ratio of  6,982/quality - adjusted life years ( qaly ) was estimated for the baseline cohort of 50-year - old male patients . given the commonly accepted threshold of  40,000/qaly , hdf is cost - effective . 
 the probabilistic sensitivity analysis showed that hdf is cost - effective with a probability of ~81% at a threshold of  40,000/qaly . 
 it is fundamental to measure the outcome also in terms of quality of life . 
 hdf is more cost - effective for younger patients.conclusionhdf can be considered cost - effective compared to hf - hd . ","hdf, cost, hf, hd, effectiveness",backgroundclin studi suggest hemodiafiltr hdf may lead well clinic outcom high flux hemodialysi hf hd concern rais cost effect hdf versu hf hd aim studi investig whether clinic benefit term long surviv well health relat qualiti life worth possibl high cost hdf compar hfhdmethodsth analysi compris simul base combin result previou publish studi follow step 1 estim surviv function hf hd patient clinic trial hdf patient use risk reduct estim meta analysi 2 simul surviv sampl patient alloc hf hd hdf use three state markov model 3 applic state specif health relat qualiti life coeffici differenti cost deriv literatur sever mont carlo simul perform includ simul patient differ risk profil exampl age patient age 40 50 60 year sex diabet statu scatter plot simul cost effect plane produc increment cost effect ratio estim cost effect accept curv computedresultsan increment cost effect ratio 6982qualiti adjust life year qali estim baselin cohort 50year old male patient give commonli accept threshold 40000qali hdf cost effect probabilist sensit analysi show hdf cost effect probabl 81 threshold 40000qali fundament measur outcom also term qualiti life hdf cost effect young patientsconclusionhdf consid cost effect compar hf hd
" alzheimer s disease ( ad ) is the most common form of dementia in the elderly , and it is characterized by progressive impairment in multiple cognitive domains of sufficient severity to interfere with individuals daily living activities . 
 historically , the diagnosis of ad has been based on the identification of a clinical syndrome , and accuracy studies of the current clinical criteria conducted in referral clinics have shown high sensitivity for ad . however , the identification of the disease is still not perfect , and there is growing evidence that the use of biomarkers will increase our ability to better indentify the underlying biology of ad , especially in its early stages . 
 these biomarkers will improve the detection of the patients suitable for research studies and drug trials , and they will contribute to a better management of the disease in the clinical practice . in this review , we discuss the most studied biomarkers in ad : cerebrospinal fluid proteins , structural magnetic resonance imaging , functional neuroimaging techniques , and amyloid imaging . ","ad, biomarkers, identification, clinical, disease",alzheim disea ad common form dementia elderli character progress impair multipl cognit domain suffici sever interfer individu daili live activ histor diagnosi ad base identif clinic syndrom accuraci studi current clinic criterion conduct referr clinic show high sensit ad howev identif disea still perfect grow evid use biomark increa abil well indentifi underli biolog ad especi earli stage biomark improv detect patient suitabl research studi drug trial contribut well manag disea clinic practic review discuss studi biomark ad cerebrospin fluid protein structur magnet reson imag function neuroimag techniqu amyloid imag
" background : spinocerebellar ataxia type 3 ( sca3 ) is the most common subtype of sca worldwide , and runs a slowly progressive and unremitting disease course . 
 there is currently no curable treatment available . 
 growing evidence has suggested that nerve growth factor ( ngf ) may have therapeutic effects in neurodegenerative diseases , and possibly also in sca3 . 
 the objective of this study was to test the efficacy of ngf in sca3 patients.methods:we performed an open - label prospective study in genetically confirmed adult ( > 18 years old ) sca3 patients . 
 ngf was administered by intramuscular injection ( 18 g once daily ) for 28 days consecutively . 
 all the patients were evaluated at baseline and 2 and 4 weeks after treatment using the chinese version of the scale for assessment and rating of ataxia ( sara).results : twenty - one sca3 patients ( 10 men and 11 women , mean age 39.14  7.81 years , mean disease duration 4.14  1.90 years , mean cag repeats number 77.57  2.27 ) were enrolled . 
 after 28 days of ngf treatment , the mean total sara score decreased significantly from a baseline of 8.48  2.40 to 6.30  1.87 ( p < 0.001 ) . 
 subsections sara scores also showed significant improvements in stance ( p = 0.003 ) , speech ( p = 0.023 ) , finger chase ( p = 0.015 ) , fast alternating hand movements ( p = 0.009 ) , and heel - shin slide ( p = 0.001).conclusions : our preliminary data suggest that ngf may be effective in treating patients with sca3 . ","sca3, ngf, sara, mean, ataxia",background spinocerebellar ataxia type 3 sca3 common subtyp sca worldwid run slowli progress unremit disea cour current curabl treatment avail grow evid suggest nerv growth factor ngf may therapeut effect neurodegen disea possibl also sca3 object studi test efficaci ngf sca3 patientsmethodsw perform open label prospect studi genet confirm adult 18 year old sca3 patient ngf administ intramuscular inject 18 g daili 28 day consecut patient evalu baselin 2 4 week treatment use chine version scale assess rate ataxia sararesult twenti one sca3 patient 10 man 11 woman mean age 3914 781 year mean disea durat 414 190 year mean cag repeat number 7757 227 enrol 28 day ngf treatment mean total sara score decrea significantli baselin 848 240 630 187 p 0001 subsect sara score also show signific improv stanc p 0003 speech p 0023 finger chase p 0015 fast altern hand movement p 0009 heel shin slide p 0001conclus preliminari datum suggest ngf may effect treat patient sca3
