Abstract,Keywords,Processed_Abstract
" summarybackgroundaluminium ( al ) is known to have neurotoxic effects that can result in oxidative damage to a range of cellular biomolecules . 
 these effects appear to be of significance in the developmental stages of the brain . 
 we therefore investigated the oxidative and histopathological damage induced by al during growth and development of the chick brain.material/methodswe used a chick embryonic development model , with al treatment of 500 g al sulphate in 0.1 ml saline injected into the egg air chambers at the beginning of their incubation period . 
 the effects on chick - brain growth and development were then assessed at term ( day 21 ) . 
 determination of malondialdehyde and glutathione levels were used as relevant biological measures for increased oxidative stress in terms of lipid peroxidation and biochemical oxidative damage , respectively . 
 furthermore , we also monitored neuronal degeneration as estimated stereologically using the cavalieri brain volume estimation tool.resultsthis al treatment showed significantly increased mda levels and decreased gsh levels , as indicators of increased biochemical oxidative damage . 
 this was accompanied by significantly decreased brain volume , as a measure of neuronal degeneration during brain development in this chick embryonic development model.conclusionsexposure to al during chick embryonic development results in increased oxidative stress in the brain that is accompanied by neuronal degeneration . ","al, oxidative, chick, brain, development",summarybackgroundaluminium al know neurotox effect result oxid damag rang cellular biomolecul effect appear signific development stage brain therefor investig oxid histopatholog damag induc al growth develop chick brainmaterialmethodsw use chick embryon develop model al treatment 500 g al sulphat 01 ml salin inject egg air chamber begin incub period effect chick brain growth develop assess term day 21 determin malondialdehyd glutathion level use relev biolog measur increa oxid stress term lipid peroxid biochem oxid damag respect furthermor also monitor neuron degener estim stereolog use cavalieri brain volum estim toolresultsthi al treatment show significantli increa mda level decrea gsh level indic increa biochem oxid damag accompani significantli decrea brain volum measur neuron degener brain develop chick embryon develop modelconclusionsexposur al chick embryon develop result increa oxid stress brain accompani neuron degener
" 
 purpose . to quantify the frequency of visual loss after successful retinal detachment ( rd ) surgery in macula - on patients in a multicentric , prospective series of rd 
 . methods . clinical variables from consecutive macula - on rd patients were collected in a prospective multicentric study . 
 visual loss was defined as at least a reduction in one line in best corrected visual acuity ( va ) with snellen chart . 
 the series were divided into 4 subgroups : ( 1 ) all macula - on eyes ( n = 357 ) ; ( 2 ) macula - on patients with visual loss at the third month of follow - up ( n = 53 ) which were further subdivided in ( 3 ) phakic eyes ( n = 39 ) ; and ( 4 ) pseudophakic eyes ( n = 14 ) . 
 results . 
 fifty - three eyes ( 14.9% ) had visual loss three months after surgery ( n = 39 phakic eyes ; n = 14 pseudophakic eyes ) . there were no statistically significant differences between them regarding their clinical characteristics . 
 pars plana vitrectomy ( ppv ) was used in 67.2% of cases , scleral buckle in 57.7% , and scleral explant in 11.9% ( 36.1% were combined procedures ) . 
 conclusions . around 15% of macula - on rd eyes lose va after successful surgery . 
 development of cataracts may be one cause in phakic eyes , but vision loss in pseudophakic eyes could have other explanations such as the effect of released factors produced by retinal ischemia on the macula area . 
 further investigations are necessary to elucidate this hypothesis . ","eyes, macula, rd, visual, loss",purpos quantifi frequenc visual loss success retin detach rd surgeri macula patient multicentr prospect seri rd method clinic variabl consecut macula rd patient collect prospect multicentr studi visual loss defin least reduct one line good correct visual acuiti va snellen chart seri divid 4 subgroup 1 macula eye n 357 2 macula patient visual loss third month follow n 53 subdivid 3 phakic eye n 39 4 pseudophak eye n 14 result fifti three eye 149 visual loss three month surgeri n 39 phakic eye n 14 pseudophak eye statist signific differ regard clinic characterist par plana vitrectomi ppv use 672 case scleral buckl 577 scleral explant 119 361 combin procedur conclus around 15 macula rd eye lose va success surgeri develop cataract may one caus phakic eye vision loss pseudophak eye could explan effect relea factor produc retin ischemia macula area investig necessari elucid hypothesi
" diclofenac , a nonsteroidal anti - inflammatory drug , induces apoptosis on the neuroblastoma cell line sh - sy5y through a mitochondrial dysfunction , affecting some antioxidant mechanisms . 
 indeed , the time- and dose - dependent increase of apoptosis is associated to an early enhancement of the reactive oxygen species ( ros ) . 
 mitochondrial superoxide dismutase ( sod2 ) plays a crucial role in the defence against ros , thus protecting against several apoptotic stimuli . 
 diclofenac decreased the protein levels and the enzymatic activity of sod2 , without any significant impairment of the corresponding mrna levels in the sh - sy5y extracts . 
 when cells were incubated with an archaeal exogenous thioredoxin , an attenuation of the diclofenac - induced apoptosis was observed , together with an increase of sod2 protein levels . 
 furthermore , diclofenac impaired the mitochondrial membrane potential , leading to a release of cytochrome c. these data suggest that mitochondria are involved in the diclofenac - induced apoptosis of sh - sy5y cells and point to a possible role of sod2 in this process . ","diclofenac, sod2, apoptosis, sy5y, sh",diclofenac nonsteroid anti inflammatori drug induc apoptosi neuroblastoma cell line sh sy5i mitochondri dysfunct affect antioxid mechan inde time dose depend increa apoptosi associ earli enhanc reactiv oxygen speci ro mitochondri superoxid dismuta sod2 play crucial role defenc ro thu protect sever apoptot stimulus diclofenac decrea protein level enzymat activ sod2 without signific impair correspond mrna level sh sy5i extract cell incub archaeal exogen thioredoxin attenu diclofenac induc apoptosi observ togeth increa sod2 protein level furthermor diclofenac impair mitochondri membran potenti lead relea cytochrom c datum suggest mitochondria involv diclofenac induc apoptosi sh sy5i cell point possibl role sod2 process
" the contamination of seafood by bacteria of fecal origin , especially escherichia coli , is a widely documented sanitary problem . 
 the objective of the present study was to isolate e. coli strains from the gills , muscle , and body surface of farmed nile tilapias ( oreochromis niloticus ) fresh - marketed in supermarkets in fortaleza ( cear , brazil ) , to determine their susceptibility to antibiotics of different families ( amikacin , gentamicin , imipenem , cephalothin , cefotaxime , ciprofloxacin , aztreonam , ampicillin , nalidixic acid , tetracycline , and sulfametoxazol - trimetoprim ) , and to determine the nature of resistance by plasmid curing . 
 forty - four strains ( body surface = 25 , gills = 15 , muscle = 4 ) were isolated , all of which were susceptible to amikacin , aztreonam , cefotaxime , ciprofloxacin , gentamicin , and imipenem . 
 gill and body surface samples yielded 11 isolates resistant to ampicillin , tetracycline , and sulfametoxazol - trimetoprim , 4 of which of plasmidial nature . 
 the multiple antibiotic resistance index was higher for strains isolated from body surface than from gills . 
 the overall high antibiotic susceptibility of e. coli strains isolated from fresh - marketed tilapia was satisfactory , although the occasional finding of plasmidial resistance points to the need for close microbiological surveillance of the farming , handling , and marketing conditions of aquaculture products . ","strains, gills, coli, surface, body",contamin seafood bacteria fecal origin especi escherichia coli wide document sanitari problem object present studi isol e coli strain gill muscl bodi surfac farm nile tilapia oreochromi niloticu fresh market supermarket fortaleza cear brazil determin suscept antibiot differ famili amikacin gentamicin imipenem cephalothin cefotaxim ciprofloxacin aztreonam ampicillin nalidix acid tetracyclin sulfametoxazol trimetoprim determin natur resist plasmid cure forti four strain bodi surfac 25 gill 15 muscl 4 isol suscept amikacin aztreonam cefotaxim ciprofloxacin gentamicin imipenem gill bodi surfac sampl yield 11 isol resist ampicillin tetracyclin sulfametoxazol trimetoprim 4 plasmidi natur multipl antibiot resist index high strain isol bodi surfac gill overal high antibiot suscept e coli strain isol fresh market tilapia satisfactori although occasion find plasmidi resist point need close microbiolog surveil farm handl market condit aquacultur product
" exclusively dopamine producing retroperitoneal paragangliomas are extremely rare . 
 we have experienced the first korean case managed successfully based on the proper evaluation . 
 a 26-year - old female patient came to our attention after the accidental detection of an adrenal mass . 
 she had no symptoms and denied any family history . 
 laboratory evaluations were normal but serum dopamine ( 425 
 ng / l ) and 24-hour urine dopamine levels ( 1,565.3 g / day ) were elevated . 
 she underwent laparoscopic right adrenalectomy . 
 histopathological diagnosis was a paraganglioma . 
 after operation , dopamine levels in serum and 24-hour urine dropped to 0.09 ng / l and 388.4 g / day . 
 dopamine producing paraganglioma elicit no clinical symptoms . 
 only the dopamine level is elevated in serum and 24-hour urine samples . 
 surgical resection without using preoperative alpha blockage is the treatment of choice . 
 the prognosis for patients with this tumor tends to be poor because the diagnosis is usually delayed due to lack of symptoms . ","dopamine, hour, urine, paraganglioma, serum",exclus dopamin produc retroperiton paraganglioma extrem rare experienc first korean case manag success base proper evalu 26year old femal patient come attent accident detect adren mass symptom deni famili histori laboratori evalu normal serum dopamin 425 ng l 24hour urin dopamin level 15653 g day elev underw laparoscop right adrenalectomi histopatholog diagnosi paraganglioma oper dopamin level serum 24hour urin drop 009 ng l 3884 g day dopamin produc paraganglioma elicit clinic symptom dopamin level elev serum 24hour urin sampl surgic resect without use preoper alpha blockag treatment choic prognosi patient tumor tend poor diagnosi usual delay due lack symptom
" pulmonary thromboembolism is a very rare event in children , but the mortality rate is reported to be approximately 10% . 
 the majority of children with thromboemboli have multiple risk factors , such as a catheter - related thrombosis , an infection , and a congenital prothrombotic disorder . 
 hypereosinophilia is very rarely associated with pulmonary emboli in adults ; however , this condition has not been reported in children . 
 we present a 12-year - old boy who had a pulmonary thromboembolism and deep vein thrombosis associated with hypereosinophilia and thrombocytopenia . 
 the thromboembolism was managed with anticoagulant therapy and the hypereosinophilia resolved spontaneously . ","hypereosinophilia, thromboembolism, pulmonary, children, thrombosis",pulmonari thromboembol rare event child mortal rate report approxim 10 major child thromboemboli multipl risk factor cathet relat thrombosi infect congenit prothrombot disord hypereosinophilia rare associ pulmonari embolus adult howev condit report child present 12year old boy pulmonari thromboembol deep vein thrombosi associ hypereosinophilia thrombocytopenia thromboembol manag anticoagul therapi hypereosinophilia resolv spontan
" purpose : of this study was to explore the effect of social support on the levels of anxiety and depression of hemodialysis patients.material and methods:258 patients undergoing hemodialysis were enrolled . a questionnaire developed for the purpose of the study 
 was used to collect data through the interview process . apart from socio - demographic , clinical and other characteristics 
 , the questionnaire also included the multidimensional scale of perceived social support ( mspss ) to assess social support from significant others , family and friends , and the questionnaire hospital anxiety and depression scale ( hads ) to assess the levels of anxiety and depression of patients.results:53,9% of the participants were male while 34,1% of the participants were > 70 years old . 32,9% and 30,2% of the participants felt high levels of anxiety and depression , respectively . 
 analysis of data showed a statistically significant association between anxiety / depression and social support from significant others , family and friends ( p=<0,001 for all associations ) . 
 in particular , patients with high levels of anxiety and depression felt less support from their significant others , family and friends . 
 the multinomial logistic regression , showed a statistically significant effect of social support from friends in anxiety levels ( p=0,004 ) . 
 an one point increase of the support from friends seems to reduce by 57% the probability of having high levels of anxiety . in addition , statistically significant effect of social support from significant others , family and friends was observed on the levels of depression ( p=<0,001 , p=0,001 & p=0,003 , respectively ) . 
 specifically , an one point increase of the support from significant others , family and friends it was found to reduce by 77% , 71% and 56% respectively the probability of experiencing high levels of depression.conclusions:phyco-social evaluation is essential when providing holistic care to hemodialysis patients . ","friends, anxiety, support, depression, social",purpos studi explor effect social support level anxieti depress hemodialysi patientsmateri methods258 patient undergo hemodialysi enrol questionnair develop purpos studi use collect datum interview process apart socio demograph clinic characterist questionnair also includ multidimension scale perceiv social support mspss assess social support signific other famili friend questionnair hospit anxieti depress scale have assess level anxieti depress patientsresults539 particip male 341 particip 70 year old 329 302 particip feel high level anxieti depress respect analysi datum show statist signific associ anxieti depress social support signific other famili friend p0001 associ particular patient high level anxieti depress feel less support signific other famili friend multinomi logist regress show statist signific effect social support friend anxieti level p0004 one point increa support friend seem reduc 57 probabl high level anxieti addit statist signific effect social support signific other famili friend observ level depress p0001 p0001 p0003 respect specif one point increa support signific other famili friend find reduc 77 71 56 respect probabl experienc high level depressionconclusionsphycosoci evalu essenti provid holist care hemodialysi patient
" esophageal achalasia is a motility disorder characterized by impaired relaxation of the lower esophageal sphincter and dilatation of the distal two - thirds of the esophagus . 
 this condition may be a non - frequent reason of extrinsic compression of left atrium . in turn 
 , this can be a cause of some hemodynamic changes such as chest discomfort , dyspnea or reduced exercise tolerance , systemic hypotension and tachycardia . 
 we describe a case of a patient with esophagus achalasia compressing the left atrium and inducing hemodynamic compromise . 
 the diagnostic methods , as chest x - ray , computed tomography ( ct ) , manometry , and 2d - trans - thoracic echocardiography ( tte ) demonstrated the esophagus dilation , the impaired relaxation of the lower esophageal sphincter , and its compression on the left atrium . 
 three - d trans - thoracic echocardiography ( 3d - tte ) was firstly performed also . 
 this last examination pointed out better than 2d - tte the extrinsic compression of the left atrium due to the esophagus dilatation . 
 therefore , 3d - tte is a true improvement for the echocardiographic diagnosis of the left atrial compression induced by esophageal achalasia . ","tte, atrium, esophagus, esophageal, compression",esophag achalasia motil disord character impair relax lower esophag sphincter dilat distal two third esophagu condit may non frequent reason extrin compress leave atrium turn caus hemodynam chang chest discomfort dyspnea reduc exercis toler system hypoten tachycardia describ case patient esophagu achalasia compress leave atrium induc hemodynam compromis diagnost method chest x ray comput tomographi ct manometri 2d tran thorac echocardiographi tte demonstr esophagu dilat impair relax lower esophag sphincter compress leave atrium three tran thorac echocardiographi 3d tte firstli perform also last examin point well 2d tte extrin compress leave atrium due esophagu dilat therefor 3d tte true improv echocardiograph diagnosi leave atrial compress induc esophag achalasia
" due primarily to the increasing shortage of allogeneic donor organs , xenotransplantation has become the focus of a growing field of research . 
 currently , micropigs are the most suitable donor animal for humans . however , no standard method has been developed to evaluate the systemic vascular anatomy of micropigs and standard reference values to aid in the selection of normal healthy animals as potential organ donors are lacking . using 64-channel multidetector row computed tomographic angiography ( mdcta ) , we evaluated morphological features of the major systemic vessels in micropigs and compared our results to published human data . 
 the main vasculature of the animals was similar to that of humans , except for the iliac arterial system . 
 however , diameters of the major systemic vessels were significantly different between micropigs and humans . 
 specifically , the diameter of the aortic arch , abdominal aorta , external iliac artery , and femoral artery , were measured as 1.50  0.07 cm , 0.85  0.06 cm , 0.52  0.05 cm , and 0.48  0.05 cm , respectively , in the micropigs . 
 this mdcta data for micropig major systemic vessels can be used as standard reference values for xenotransplantation studies . 
 the use of 64-channel mdcta enables accurate evaluation of the major systemic vasculature in micropigs . ","micropigs, systemic, mdcta, cm, vessels",due primarili increa shortag allogen donor organ xenotransplant becom focu grow field research current micropig suitabl donor anim human howev standard method develop evalu system vascular anatomi micropig standard refer valu aid select normal healthi anim potenti organ donor lack use 64channel multidetector row comput tomograph angiographi mdcta evalu morpholog featur major system vessel micropig compar result publish human datum main vasculatur anim similar human except iliac arteri system howev diamet major system vessel significantli differ micropig human specif diamet aortic arch abdomin aorta extern iliac arteri femor arteri measur 150 007 cm 085 006 cm 052 005 cm 048 005 cm respect micropig mdcta datum micropig major system vessel use standard refer valu xenotransplant studi use 64channel mdcta enabl accur evalu major system vasculatur micropig
" amide hydrogen / deuterium exchange ( h / d exchange ) coupled with mass spectrometry has been widely used to analyze the interface of protein - protein interactions , protein conformational changes , protein dynamics and protein - ligand interactions . 
 h / d exchange on the backbone amide positions has been utilized to measure the deuteration rates of the micro - regions in a protein by mass spectrometry1,2,3 . 
 the resolution of this method depends on pepsin digestion of the deuterated protein of interest into peptides that normally range from 3 - 20 residues . 
 although the resolution of h / d exchange measured by mass spectrometry is lower than the single residue resolution measured by the heteronuclear single quantum coherence ( hsqc ) method of nmr , the mass spectrometry measurement in h / d exchange is not restricted by the size of the protein4 . 
 h / d exchange is carried out in an aqueous solution which maintains protein conformation . we provide a method that utilizes the maldi - tof for detection2 , instead of a hplc / esi ( electrospray ionization)-ms system5,6 . 
 the maldi - tof provides accurate mass intensity data for the peptides of the digested protein , in this case protein kinase pak2 ( also called -pak ) . 
 proteolysis of pak 2 is carried out in an offline pepsin digestion . 
 this alternative method , when the user does not have access to a hplc and pepsin column connected to mass spectrometry , or when the pepsin column on hplc does not result in an optimal digestion map , for example , the heavily disulfide - bonded secreted phospholipase a2 ( spla2 ) . 
 utilizing this method , we successfully monitored changes in the deuteration level during activation of pak2 by caspase 3 cleavage and autophosphorylation7,8,9 . ","exchange, protein, pepsin, spectrometry, mass",amid hydrogen deuterium exchang h exchang coupl mass spectrometri wide use analyz interfac protein protein interact protein conform chang protein dynam protein ligand interact h exchang backbon amid posit util measur deuter rate micro region protein mass spectrometry123 resolut method depend pepsin digest deuter protein interest peptid normal rang 3 20 residu although resolut h exchang measur mass spectrometri lower singl residu resolut measur heteronuclear singl quantum coher hsqc method nmr mass spectrometri measur h exchang restrict size protein4 h exchang carri aqueou solut maintain protein conform provid method util maldi tof detection2 instead hplc esi electrospray ionizationm system56 maldi tof provid accur mass inten datum peptid digest protein case protein kina pak2 also call pak proteolysi pak 2 carri offlin pepsin digest altern method user access hplc pepsin column connect mass spectrometri pepsin column hplc result optim digest map exampl heavili disulfid bond secret phospholipa a2 spla2 util method success monitor chang deuter level activ pak2 caspa 3 cleavag autophosphorylation789
" according to a patient - centered viewpoint , the meaning of harmonization in the context of laboratory medicine is that the information should be comparable irrespective of the measurement procedure used and where and/or when a measurement is made . 
 harmonization represents a fundamental aspect of quality in laboratory medicine as its ultimate goal is to improve patient outcomes through the provision of an accurate and actionable laboratory information . 
 although the initial focus has to a large extent been to harmonize and standardize analytical processes and methods , the scope of harmonization goes beyond to include all other aspects of the total testing process ( ttp ) , such as terminology and units , report formats , reference intervals and decision limits , as well as tests and test profiles request and criteria for interpretation . 
 two major progresses have been made in the area of harmonization in laboratory medicine : first , the awareness that harmonization should take into consideration not only the analytical phase but all steps of the ttp , thus dealing with the request , the sample , the measurement , and the report . 
 second , as the processes required to achieve harmonization are complicated , a systematic approach is needed . 
 the international federation of clinical chemistry and laboratory medicine ( ifcc ) has played a fundamental and successful role in the development of standardized and harmonized assays , and now it should continue to work in the field through the collaboration and cooperation with many other stakeholders . ","harmonization, laboratory, medicine, measurement, request",accord patient center viewpoint mean harmon context laboratori medicin inform compar irrespect measur procedur use andor measur make harmon repre fundament aspect qualiti laboratori medicin ultim goal improv patient outcom provis accur action laboratori inform although initi focu larg extent harmon standard analyt process method scope harmon goe beyond includ aspect total test process ttp terminolog unit report format refer interv decis limit well test test profil request criterion interpret two major progress make area harmon laboratori medicin first awar harmon take consider analyt phase step ttp thu deal request sampl measur report second process requir achiev harmon complic systemat approach need intern feder clinic chemistri laboratori medicin ifcc play fundament success role develop standard harmon assay continu work field collabor cooper mani stakehold
